{
  "schema": "lawradar-universal-signal-v2",
  "run": {
    "id": "39281176896",
    "attempt": "1",
    "url": "https://github.com/vexxonsult/lawradar-handoff/actions/runs/39281176896",
    "commit": "d74cf0ca50297f84c8f3c85ece4dc12f4b70683a",
    "report_date": "2026-10-18"
  },
  "context": {
    "coverage": "1/1 candidats traités indépendamment par Message Batch",
    "delta_changed_sources": [
      "consultdd-latest.json"
    ],
    "handled_source_files": [
      "jorf-summaries-latest.json",
      "consultdd-latest.json"
    ],
    "rule": "Preuves locales diffées uniquement ; réapparition historique et routine administrative explicite = filtrées avec trace ; les autres textes primaires disponibles reçoivent une lecture factuelle. Une friction détectée ouvre seulement une enquête, jamais une opportunité confirmée ; inconnu = UNRESOLVED.",
    "prefilter_audit": {
      "excluded_historical_candidates": [],
      "excluded_routine_candidates": [],
      "excluded_no_economic_friction_candidates": [],
      "deterministically_unresolved_candidates": []
    }
  },
  "signals": [
    {
      "id": "signal:e37ab6683cb646f9",
      "identity": {
        "stable_source_id": "source:01165860073b5c1b",
        "evidence_version": "sha256:b8bfed365fd2b02bbb675b0c6f9b8f0884dd5321118992cb6099d6cef16db61e"
      },
      "source": {
        "source_id": "consultdd:https://www.consultations-publiques.developpement-durable.gouv.fr/projet-d-arrete-relatif-a-l-epandage-des-dechets-a3465.html",
        "source_kind": "CONSULTDD",
        "change": "NEW",
        "evidence": {
          "text_id": null,
          "nature": null,
          "nor": null,
          "title": "Projet d’arrêté relatif à l'épandage des déchets, effluents et résidus des install...",
          "publisher": null,
          "url": "https://www.consultations-publiques.developpement-durable.gouv.fr/projet-d-arrete-relatif-a-l-epandage-des-dechets-a3465.html",
          "publication_date": null,
          "journal_number": null,
          "article_ids": [],
          "article_titles": [],
          "dates": [
            "2026-10-19",
            "2026-10-19"
          ],
          "detail_status": "PRIMARY_PAGE_READ",
          "official": {
            "title": "Projet d’arrêté relatif à l’épandage des déchets, effluents et résidus des installations relevant de l’article L. 511-1 du code de l’environnement",
            "period": "Consultation du 19/10/2026 au 08/11/2026 - aucune contribution"
          },
          "attachments": [],
          "evidence_excerpts": [],
          "primary_evidence": {
            "content_status": null,
            "text_sha256": null,
            "excerpt": null,
            "excerpt_truncated": false,
            "archive_url": null,
            "archive_sha256": null
          }
        }
      },
      "radar": {
        "status": "DISCARDED",
        "reason": "Consultation publique réglementaire (ICPE/épandage) sans preuve de friction économique exploitable ni de service B2B documenté ; classé CONTEXT_REVIEW par le discovery, confirmé DISCARDED faute d'éléments financiers ou d'offre."
      },
      "discovery": {
        "schema": "lawradar-opportunity-discovery-v1",
        "status": "CONTEXT_REVIEW",
        "score": 3,
        "triggers": [
          {
            "kind": "OFFICIAL_PUBLIC_CONSULTATION",
            "score": 3,
            "terms": []
          }
        ],
        "scope_terms": [],
        "reason": "NO_ECONOMIC_FRICTION_EVIDENCE"
      },
      "reading": {
        "consequence": "Les exploitants d'installations ICPE pratiquant l'épandage de déchets, effluents ou résidus devront, à partir du 1er janvier 2027, respecter les nouveaux critères d'innocuité du « socle commun » des matières fertilisantes, notamment les seuils d'éléments traces métalliques ; les plans d'épandage existants devront être mis en conformité au plus tard le 1er janvier 2029.",
        "affected_actors": [
          "exploitants d'ICPE pratiquant l'épandage",
          "ministère chargé de l'environnement",
          "ministère chargé de l'agriculture"
        ],
        "beneficiaries": [],
        "constrained_parties": [
          "exploitants d'ICPE avec plan d'épandage approuvé ou en cours de demande"
        ],
        "potential_service_partners": [],
        "unknowns": [
          "impact économique précis de la mise en conformité pour les exploitants",
          "modalités techniques détaillées de contrôle des critères d'innocuité",
          "suites données à la consultation publique"
        ]
      },
      "reading_provenance": {
        "status": "AVAILABLE",
        "basis": "CANDIDATE_EVIDENCE_ONLY",
        "producer": "MOTOR_STRUCTURED_READING",
        "source_id": "consultdd:https://www.consultations-publiques.developpement-durable.gouv.fr/projet-d-arrete-relatif-a-l-epandage-des-dechets-a3465.html"
      },
      "opportunity_facts": {
        "schema": "lawradar-opportunity-facts-v1",
        "signal_id": "signal:e37ab6683cb646f9",
        "title": "Projet d'arrêté relatif à l'épandage des déchets, effluents et résidus des installations ICPE",
        "keywords": [
          "épandage",
          "ICPE",
          "déchets",
          "matières fertilisantes",
          "socle commun",
          "plan d'épandage"
        ],
        "affected_scope": [
          "installations ICPE",
          "plans d'épandage",
          "matières fertilisantes et supports de culture"
        ],
        "legal": {
          "jurisdiction": "FR",
          "text_status": "CONSULTATION_OPEN",
          "proof_status": "PARTIAL",
          "effective_date": "2027-01-01",
          "affected_scope": [
            "exploitants ICPE soumis à épandage",
            "installations existantes avec plan d'épandage approuvé"
          ]
        },
        "requirements": {
          "required_capabilities": [],
          "required_authorizations": [
            {
              "id": "plan d'épandage conforme au socle commun",
              "status": "REQUIRED"
            }
          ],
          "dependencies": [
            {
              "id": "décret n°2026-919 du 18/09/2026",
              "status": "AVAILABLE"
            },
            {
              "id": "arrêtés du 18/09/2026 (socle commun)",
              "status": "AVAILABLE"
            }
          ],
          "minimum_startup_capital_eur": null,
          "estimated_time_to_market_weeks": null,
          "evidence_status": "PARTIAL"
        },
        "operator_access": {
          "sector": "NOT_CLASSIFIED",
          "direct_offer_status": "NOT_APPLICABLE",
          "peripheral_role_evidence": "MISSING",
          "evidence_status": "MISSING",
          "peripheral_service_evidence": []
        }
      },
      "enrichments": {
        "press": {
          "status": "PENDING",
          "result": null
        },
        "demand": {
          "status": "PENDING",
          "result": null
        },
        "market": {
          "status": "PENDING",
          "result": null
        }
      }
    }
  ],
  "money_flows": [],
  "quality": {
    "opportunity_count": 1,
    "unresolved_count": 0,
    "readings_available_count": 1,
    "evidence_reference_count": 1,
    "money_flow_count": 0,
    "money_flow_unlinked_count": 0,
    "limitation": "Les enrichissements sont vides tant qu'aucun agent dédié n'a produit une sortie sourcée."
  }
}
