{
  "schema": "lawradar-universal-signal-v2",
  "run": {
    "id": "34825003341",
    "attempt": "1",
    "url": "https://github.com/vexxonsult/lawradar-handoff/actions/runs/34825003341",
    "commit": "0cb128e04a094c8f87191f08e08378c616ee7402",
    "report_date": "2026-09-13"
  },
  "context": {
    "coverage": "0 candidat envoyé au modèle",
    "delta_changed_sources": [
      "jorf-summaries-latest.json",
      "eurlex-oj-latest.json"
    ],
    "handled_source_files": [
      "jorf-summaries-latest.json",
      "consultdd-latest.json"
    ],
    "rule": "Preuves locales diffées uniquement ; réapparition historique et routine administrative explicite = filtrées avec trace ; les autres textes primaires disponibles reçoivent une lecture factuelle. Une friction détectée ouvre seulement une enquête, jamais une opportunité confirmée ; inconnu = UNRESOLVED.",
    "prefilter_audit": {
      "excluded_historical_candidates": [
        {
          "source_id": "jorf:JORFTEXT000000177408",
          "publication_date": "1993-01-06",
          "reason": "HISTORICAL_REAPPEARANCE_OUTSIDE_CURRENT_COVERAGE"
        },
        {
          "source_id": "jorf:JORFTEXT000000315808",
          "publication_date": "1953-02-04",
          "reason": "HISTORICAL_REAPPEARANCE_OUTSIDE_CURRENT_COVERAGE"
        },
        {
          "source_id": "jorf:JORFTEXT000000320196",
          "publication_date": "1983-07-27",
          "reason": "HISTORICAL_REAPPEARANCE_OUTSIDE_CURRENT_COVERAGE"
        },
        {
          "source_id": "jorf:JORFTEXT000000324964",
          "publication_date": "1983-12-28",
          "reason": "HISTORICAL_REAPPEARANCE_OUTSIDE_CURRENT_COVERAGE"
        },
        {
          "source_id": "jorf:JORFTEXT000000354223",
          "publication_date": "1995-05-13",
          "reason": "HISTORICAL_REAPPEARANCE_OUTSIDE_CURRENT_COVERAGE"
        },
        {
          "source_id": "jorf:JORFTEXT000000600694",
          "publication_date": "2003-10-07",
          "reason": "HISTORICAL_REAPPEARANCE_OUTSIDE_CURRENT_COVERAGE"
        },
        {
          "source_id": "jorf:JORFTEXT000000675912",
          "publication_date": "1965-06-05",
          "reason": "HISTORICAL_REAPPEARANCE_OUTSIDE_CURRENT_COVERAGE"
        },
        {
          "source_id": "jorf:JORFTEXT000000700561",
          "publication_date": "1987-06-17",
          "reason": "HISTORICAL_REAPPEARANCE_OUTSIDE_CURRENT_COVERAGE"
        },
        {
          "source_id": "jorf:JORFTEXT000000813276",
          "publication_date": "2005-08-06",
          "reason": "HISTORICAL_REAPPEARANCE_OUTSIDE_CURRENT_COVERAGE"
        },
        {
          "source_id": "jorf:JORFTEXT000000880186",
          "publication_date": "1955-01-06",
          "reason": "HISTORICAL_REAPPEARANCE_OUTSIDE_CURRENT_COVERAGE"
        },
        {
          "source_id": "jorf:JORFTEXT000020337297",
          "publication_date": "2009-03-04",
          "reason": "HISTORICAL_REAPPEARANCE_OUTSIDE_CURRENT_COVERAGE"
        },
        {
          "source_id": "jorf:JORFTEXT000022160267",
          "publication_date": "2010-05-04",
          "reason": "HISTORICAL_REAPPEARANCE_OUTSIDE_CURRENT_COVERAGE"
        },
        {
          "source_id": "jorf:JORFTEXT000023502846",
          "publication_date": "2011-02-03",
          "reason": "HISTORICAL_REAPPEARANCE_OUTSIDE_CURRENT_COVERAGE"
        },
        {
          "source_id": "jorf:JORFTEXT000025789531",
          "publication_date": "2012-05-03",
          "reason": "HISTORICAL_REAPPEARANCE_OUTSIDE_CURRENT_COVERAGE"
        },
        {
          "source_id": "jorf:JORFTEXT000028216496",
          "publication_date": "2013-11-20",
          "reason": "HISTORICAL_REAPPEARANCE_OUTSIDE_CURRENT_COVERAGE"
        },
        {
          "source_id": "jorf:JORFTEXT000029799204",
          "publication_date": "2014-11-26",
          "reason": "HISTORICAL_REAPPEARANCE_OUTSIDE_CURRENT_COVERAGE"
        },
        {
          "source_id": "jorf:JORFTEXT000030405903",
          "publication_date": "2015-03-29",
          "reason": "HISTORICAL_REAPPEARANCE_OUTSIDE_CURRENT_COVERAGE"
        },
        {
          "source_id": "jorf:JORFTEXT000030440401",
          "publication_date": "2015-04-05",
          "reason": "HISTORICAL_REAPPEARANCE_OUTSIDE_CURRENT_COVERAGE"
        },
        {
          "source_id": "jorf:JORFTEXT000032378113",
          "publication_date": "2016-04-10",
          "reason": "HISTORICAL_REAPPEARANCE_OUTSIDE_CURRENT_COVERAGE"
        },
        {
          "source_id": "jorf:JORFTEXT000032797752",
          "publication_date": "2016-06-30",
          "reason": "HISTORICAL_REAPPEARANCE_OUTSIDE_CURRENT_COVERAGE"
        },
        {
          "source_id": "jorf:JORFTEXT000033471858",
          "publication_date": "2016-11-25",
          "reason": "HISTORICAL_REAPPEARANCE_OUTSIDE_CURRENT_COVERAGE"
        },
        {
          "source_id": "jorf:JORFTEXT000036964133",
          "publication_date": "2018-05-31",
          "reason": "HISTORICAL_REAPPEARANCE_OUTSIDE_CURRENT_COVERAGE"
        },
        {
          "source_id": "jorf:JORFTEXT000039407796",
          "publication_date": "2019-11-22",
          "reason": "HISTORICAL_REAPPEARANCE_OUTSIDE_CURRENT_COVERAGE"
        },
        {
          "source_id": "jorf:JORFTEXT000039675844",
          "publication_date": "2019-12-27",
          "reason": "HISTORICAL_REAPPEARANCE_OUTSIDE_CURRENT_COVERAGE"
        },
        {
          "source_id": "jorf:JORFTEXT000041697219",
          "publication_date": "2020-03-07",
          "reason": "HISTORICAL_REAPPEARANCE_OUTSIDE_CURRENT_COVERAGE"
        },
        {
          "source_id": "jorf:JORFTEXT000043927231",
          "publication_date": "2021-08-11",
          "reason": "HISTORICAL_REAPPEARANCE_OUTSIDE_CURRENT_COVERAGE"
        },
        {
          "source_id": "jorf:JORFTEXT000045243945",
          "publication_date": "2022-02-26",
          "reason": "HISTORICAL_REAPPEARANCE_OUTSIDE_CURRENT_COVERAGE"
        },
        {
          "source_id": "jorf:JORFTEXT000045753329",
          "publication_date": "2022-05-05",
          "reason": "HISTORICAL_REAPPEARANCE_OUTSIDE_CURRENT_COVERAGE"
        },
        {
          "source_id": "jorf:JORFTEXT000046704556",
          "publication_date": "2022-12-08",
          "reason": "HISTORICAL_REAPPEARANCE_OUTSIDE_CURRENT_COVERAGE"
        },
        {
          "source_id": "jorf:JORFTEXT000048007557",
          "publication_date": "2023-08-30",
          "reason": "HISTORICAL_REAPPEARANCE_OUTSIDE_CURRENT_COVERAGE"
        },
        {
          "source_id": "jorf:JORFTEXT000049209996",
          "publication_date": "2024-02-29",
          "reason": "HISTORICAL_REAPPEARANCE_OUTSIDE_CURRENT_COVERAGE"
        },
        {
          "source_id": "jorf:JORFTEXT000049658902",
          "publication_date": "2024-06-06",
          "reason": "HISTORICAL_REAPPEARANCE_OUTSIDE_CURRENT_COVERAGE"
        },
        {
          "source_id": "jorf:JORFTEXT000049862794",
          "publication_date": "2024-07-03",
          "reason": "HISTORICAL_REAPPEARANCE_OUTSIDE_CURRENT_COVERAGE"
        },
        {
          "source_id": "jorf:JORFTEXT000050342769",
          "publication_date": "2024-10-15",
          "reason": "HISTORICAL_REAPPEARANCE_OUTSIDE_CURRENT_COVERAGE"
        },
        {
          "source_id": "jorf:JORFTEXT000052153132",
          "publication_date": "2025-08-29",
          "reason": "HISTORICAL_REAPPEARANCE_OUTSIDE_CURRENT_COVERAGE"
        },
        {
          "source_id": "jorf:JORFTEXT000052184230",
          "publication_date": "2025-09-04",
          "reason": "HISTORICAL_REAPPEARANCE_OUTSIDE_CURRENT_COVERAGE"
        },
        {
          "source_id": "jorf:JORFTEXT000052457177",
          "publication_date": "2025-10-30",
          "reason": "HISTORICAL_REAPPEARANCE_OUTSIDE_CURRENT_COVERAGE"
        },
        {
          "source_id": "jorf:JORFTEXT000053011324",
          "publication_date": "2025-12-11",
          "reason": "HISTORICAL_REAPPEARANCE_OUTSIDE_CURRENT_COVERAGE"
        },
        {
          "source_id": "jorf:JORFTEXT000053417209",
          "publication_date": "2026-01-30",
          "reason": "HISTORICAL_REAPPEARANCE_OUTSIDE_CURRENT_COVERAGE"
        },
        {
          "source_id": "jorf:JORFTEXT000054105063",
          "publication_date": "2026-05-17",
          "reason": "HISTORICAL_REAPPEARANCE_OUTSIDE_CURRENT_COVERAGE"
        },
        {
          "source_id": "jorf:JORFTEXT000054151992",
          "publication_date": "2026-05-30",
          "reason": "HISTORICAL_REAPPEARANCE_OUTSIDE_CURRENT_COVERAGE"
        },
        {
          "source_id": "jorf:JORFTEXT000054180939",
          "publication_date": "2026-06-03",
          "reason": "HISTORICAL_REAPPEARANCE_OUTSIDE_CURRENT_COVERAGE"
        },
        {
          "source_id": "jorf:JORFTEXT000054210426",
          "publication_date": "2026-06-07",
          "reason": "HISTORICAL_REAPPEARANCE_OUTSIDE_CURRENT_COVERAGE"
        },
        {
          "source_id": "jorf:JORFTEXT000054280843",
          "publication_date": "2026-06-20",
          "reason": "HISTORICAL_REAPPEARANCE_OUTSIDE_CURRENT_COVERAGE"
        },
        {
          "source_id": "jorf:JORFTEXT000054388298",
          "publication_date": "2026-07-05",
          "reason": "HISTORICAL_REAPPEARANCE_OUTSIDE_CURRENT_COVERAGE"
        }
      ],
      "excluded_routine_candidates": [],
      "excluded_no_economic_friction_candidates": [],
      "deterministically_unresolved_candidates": []
    }
  },
  "signals": [],
  "money_flows": [],
  "quality": {
    "opportunity_count": 0,
    "unresolved_count": 0,
    "readings_available_count": 0,
    "evidence_reference_count": 0,
    "money_flow_count": 0,
    "money_flow_unlinked_count": 0,
    "limitation": "Les enrichissements sont vides tant qu'aucun agent dédié n'a produit une sortie sourcée."
  }
}
